{
  "schema": "nabalens.journey-result/v1",
  "journey": "menus.draft-conflict",
  "title": "A stale draft save in a second page is a recoverable conflict",
  "revision": {
    "commit": "6982236f78c29327d2008366ba1ec91500e028ef",
    "branch": "ws1/evidence",
    "dirty": false
  },
  "stack": {
    "name": "ws1",
    "apiPort": 64121,
    "migrations": "20261030160000:cee297c7"
  },
  "runner": {
    "kind": "playwright",
    "version": "1.64.1"
  },
  "startedAt": "2026-10-31T15:39:01.171Z",
  "scenarios": [
    "MENUS-QA-15"
  ],
  "result": "pass",
  "reason": null,
  "checks": {
    "passed": 1,
    "failed": 0,
    "skipped": 0
  },
  "evidence": [
    {
      "kind": "log",
      "path": "logs/menus.draft-conflict.log",
      "description": "Playwright runner output (list reporter)"
    },
    {
      "kind": "screenshot",
      "path": "shots/menus.draft-conflict/01-final-page-1.png",
      "description": "Playwright attachment \"final-page-1\""
    },
    {
      "kind": "screenshot",
      "path": "shots/menus.draft-conflict/02-final-page-2.png",
      "description": "Playwright attachment \"final-page-2\""
    }
  ],
  "finishedAt": "2026-10-31T15:39:05.320Z"
}
