{
  "schema": "nabalens.journey-result/v1",
  "journey": "media.reload-metadata",
  "title": "Reloaded uploads still show thumbnail, upload date, contributor and venue (staff portfolio and admin library)",
  "revision": {
    "commit": "6982236f78c29327d2008366ba1ec91500e028ef",
    "branch": "ws1/evidence",
    "dirty": false
  },
  "stack": {
    "name": "ws1",
    "apiPort": 64121,
    "migrations": "20261030160000:cee297c7"
  },
  "runner": {
    "kind": "playwright",
    "version": "1.64.1"
  },
  "startedAt": "2026-10-31T15:36:31.255Z",
  "scenarios": [
    "MEDIA-RELOAD-METADATA"
  ],
  "result": "pass",
  "reason": null,
  "checks": {
    "passed": 1,
    "failed": 0,
    "skipped": 0
  },
  "evidence": [
    {
      "kind": "log",
      "path": "logs/media.reload-metadata.log",
      "description": "Playwright runner output (list reporter)"
    },
    {
      "kind": "screenshot",
      "path": "shots/media.reload-metadata/01-staff-portfolio.png",
      "description": "Playwright attachment \"staff-portfolio\""
    },
    {
      "kind": "screenshot",
      "path": "shots/media.reload-metadata/02-admin-library.png",
      "description": "Playwright attachment \"admin-library\""
    }
  ],
  "finishedAt": "2026-10-31T15:36:36.086Z"
}
