{
  "schema": "nabalens.journey-result/v1",
  "journey": "media.slice-profile-photo",
  "title": "slice.spec.ts: staff edit their own name and profile photo (historical 504s and 30 s timeout) (chromium)",
  "revision": {
    "commit": "6982236f78c29327d2008366ba1ec91500e028ef",
    "branch": "ws1/evidence",
    "dirty": false
  },
  "stack": {
    "name": "ws1",
    "apiPort": 64121,
    "migrations": "20261030160000:cee297c7"
  },
  "runner": {
    "kind": "playwright",
    "version": "1.64.1"
  },
  "startedAt": "2026-10-31T15:36:54.189Z",
  "scenarios": [
    "MEDIA-SLICE-PROFILE-FLAKY"
  ],
  "result": "pass",
  "reason": null,
  "checks": {
    "passed": 1,
    "failed": 0,
    "skipped": 0
  },
  "evidence": [
    {
      "kind": "log",
      "path": "logs/media.slice-profile-photo.log",
      "description": "Playwright runner output (list reporter)"
    }
  ],
  "finishedAt": "2026-10-31T15:36:56.958Z",
  "historical": {
    "source": "docs/acceptance.md#11-e2e-results-per-test-across-the-three-runs",
    "id": "MEDIA-SLICE-PROFILE-FLAKY",
    "reproducedOnHead": false
  }
}
