{
  "schema": "nabalens.journey-result/v1",
  "journey": "menus.o4-phone-project",
  "title": "The mobile-chromium project runs the staff labelling flow (config decision, narrow check)",
  "revision": {
    "commit": "6982236f78c29327d2008366ba1ec91500e028ef",
    "branch": "ws1/evidence",
    "dirty": false
  },
  "stack": {
    "name": "ws1",
    "apiPort": 64121,
    "migrations": "20261030160000:cee297c7"
  },
  "runner": {
    "kind": "playwright",
    "version": "1.64.1"
  },
  "startedAt": "2026-10-31T15:40:15.518Z",
  "scenarios": [
    "MENUS-O4"
  ],
  "result": "pass",
  "reason": null,
  "checks": {
    "passed": 1,
    "failed": 0,
    "skipped": 0
  },
  "evidence": [
    {
      "kind": "log",
      "path": "logs/menus.o4-phone-project.log",
      "description": "Playwright runner output (list reporter)"
    }
  ],
  "finishedAt": "2026-10-31T15:40:17.396Z",
  "historical": {
    "source": "docs/qa/menus-qa-report.md#4-defects-for-the-lead",
    "id": "MENUS-O4",
    "reproducedOnHead": false
  }
}
