{
  "schema": "nabalens.journey-result/v1",
  "journey": "menus.catalogue-history",
  "title": "Re-import with rename, removal, key change and category move; archive and retire keep historical labels",
  "revision": {
    "commit": "6982236f78c29327d2008366ba1ec91500e028ef",
    "branch": "ws1/evidence",
    "dirty": false
  },
  "stack": {
    "name": "ws1",
    "apiPort": 64121,
    "migrations": "20261030160000:cee297c7"
  },
  "runner": {
    "kind": "playwright",
    "version": "1.64.1"
  },
  "startedAt": "2026-10-31T15:38:29.062Z",
  "scenarios": [
    "MENUS-QA-02",
    "MENUS-QA-04"
  ],
  "result": "pass",
  "reason": null,
  "checks": {
    "passed": 1,
    "failed": 0,
    "skipped": 0
  },
  "evidence": [
    {
      "kind": "log",
      "path": "logs/menus.catalogue-history.log",
      "description": "Playwright runner output (list reporter)"
    },
    {
      "kind": "screenshot",
      "path": "shots/menus.catalogue-history/01-final-page-1.png",
      "description": "Playwright attachment \"final-page-1\""
    }
  ],
  "finishedAt": "2026-10-31T15:38:46.730Z"
}
