{
  "schema": "nabalens.journey-result/v1",
  "journey": "menus.o1-save-while-reloading",
  "title": "While the reloaded menu is loading, Save labels is disabled and sends nothing",
  "revision": {
    "commit": "6982236f78c29327d2008366ba1ec91500e028ef",
    "branch": "ws1/evidence",
    "dirty": false
  },
  "stack": {
    "name": "ws1",
    "apiPort": 64121,
    "migrations": "20261030160000:cee297c7"
  },
  "runner": {
    "kind": "playwright",
    "version": "1.64.1"
  },
  "startedAt": "2026-10-31T15:40:01.584Z",
  "scenarios": [
    "MENUS-O1"
  ],
  "result": "pass",
  "reason": null,
  "checks": {
    "passed": 1,
    "failed": 0,
    "skipped": 0
  },
  "evidence": [
    {
      "kind": "log",
      "path": "logs/menus.o1-save-while-reloading.log",
      "description": "Playwright runner output (list reporter)"
    },
    {
      "kind": "screenshot",
      "path": "shots/menus.o1-save-while-reloading/01-save-disabled-while-reloading.png",
      "description": "Playwright attachment \"save-disabled-while-reloading\""
    }
  ],
  "finishedAt": "2026-10-31T15:40:09.751Z",
  "historical": {
    "source": "docs/qa/menus-qa-report.md#4-defects-for-the-lead",
    "id": "MENUS-O1",
    "reproducedOnHead": false
  }
}
